{
  "service_key" : "e93facc04764012d7bfb002500d5d1a6" ,
  "incident_key" : "srv01/HTTP" ,
  "event_type" : "trigger" ,
  "description" : "FAILURE for production/HTTP on machine srv01.acme.com" ,
  "client" : "Sample Monitoring Service" ,
  "client_url" : "https://monitoring.service.com" ,
  "details" : {
    "ping time" : "1500ms" ,
    "load avg" : 0.75
  }
}
